{
  "schemaVersion": 3,
  "projectId": "2d9bf52e-3f71-4e58-ac8e-7c8d0b60168f",
  "entities": [
    {
      "ref": "acceptance:CHAT-001/A-01@v1",
      "kind": "acceptance",
      "id": "CHAT-001/A-01",
      "version": 1
    },
    {
      "ref": "acceptance:CHAT-001/A-02@v1",
      "kind": "acceptance",
      "id": "CHAT-001/A-02",
      "version": 1
    },
    {
      "ref": "acceptance:CHAT-001/A-03@v1",
      "kind": "acceptance",
      "id": "CHAT-001/A-03",
      "version": 1
    },
    {
      "ref": "decision:DEC-001@v1",
      "kind": "decision",
      "id": "DEC-001",
      "version": 1
    },
    {
      "ref": "decision:DEC-TODO-001@v1",
      "kind": "decision",
      "id": "DEC-TODO-001",
      "version": 1,
      "immutable": true,
      "source": {
        "path": ".www/control-ledger/registry/decisions/DEC-TODO-001.json",
        "digest": "23c7b09d1a63ee0a9ca9f9742d67bb133ff885d11a690d3ee19b3380d3d97377"
      }
    },
    {
      "ref": "decision:DEC-TRACER-001@v1",
      "kind": "decision",
      "id": "DEC-TRACER-001",
      "version": 1,
      "immutable": true,
      "source": {
        "path": ".www/control-ledger/registry/decisions/DEC-TRACER-001.json",
        "digest": "e716646c34db16d18413f7474967f8d9debbb8e22281b94add70436dfe82bede"
      }
    },
    {
      "ref": "decision:DEC-WORKBENCH-001@v1",
      "kind": "decision",
      "id": "DEC-WORKBENCH-001",
      "version": 1,
      "immutable": true,
      "source": {
        "path": ".www/control-ledger/registry/decisions/DEC-WORKBENCH-001.json",
        "digest": "6fbcdb7c5a0b20146f8c954de14e5497dec0fe5aba440c2733ffd366431bcd93"
      }
    },
    {
      "ref": "evidence:EV-WOO-845-846-UNVERIFIED-001",
      "kind": "evidence",
      "id": "EV-WOO-845-846-UNVERIFIED-001",
      "immutable": true,
      "source": {
        "path": ".www/evidence/woo-845-846/unverified-evidence.json",
        "digest": "60dcba0f8f02336c158cda4189334bc0a976cc3c99be7d9e3d854cbedbd0bb07"
      }
    },
    {
      "ref": "evidence:EV-WOO-845-EXECUTION-TESTS-001",
      "kind": "evidence",
      "id": "EV-WOO-845-EXECUTION-TESTS-001",
      "immutable": true,
      "source": {
        "path": ".www/evidence/woo-845-846/execution-run-tests.json",
        "digest": "10744fa2189ff6a16a2ad2e01a68ee4cf7d230ab8648528d1adb3758d3b0bb51"
      }
    },
    {
      "ref": "evidence:EV-WOO-846-TRACEABILITY-TESTS-001",
      "kind": "evidence",
      "id": "EV-WOO-846-TRACEABILITY-TESTS-001",
      "immutable": true,
      "source": {
        "path": ".www/evidence/woo-845-846/traceability-tests.json",
        "digest": "abd2a5cb10f7f624aade42d8a900fcba4f633252ab208f6a3479e9b3472cc3c9"
      }
    },
    {
      "ref": "exception:EXC-014@v1",
      "kind": "exception",
      "id": "EXC-014",
      "version": 1
    },
    {
      "ref": "exception:EXC-TODO-001@v1",
      "kind": "exception",
      "id": "EXC-TODO-001",
      "version": 1,
      "immutable": true,
      "source": {
        "path": ".www/control-ledger/registry/exceptions/EXC-TODO-001.json",
        "digest": "8e7fca10e9c9ee6c4a522af50c1ceaaa1368a8e23b88e8ba0365c54f889dbd10"
      }
    },
    {
      "ref": "exception:EXC-TODO-002@v1",
      "kind": "exception",
      "id": "EXC-TODO-002",
      "version": 1,
      "immutable": true,
      "source": {
        "path": ".www/control-ledger/registry/exceptions/EXC-TODO-002.json",
        "digest": "f3b1efd0bfcdf2850658515af5faf512e4baaa9f5b5a280bd353391e444323e7"
      }
    },
    {
      "ref": "exception:EXC-TODO-003@v1",
      "kind": "exception",
      "id": "EXC-TODO-003",
      "version": 1,
      "immutable": true,
      "source": {
        "path": ".www/control-ledger/registry/exceptions/EXC-TODO-003.json",
        "digest": "95bb59d1afc66502bef583f7fd99f78fc132c90853a81c7cef7be6f9bf2351f5"
      }
    },
    {
      "ref": "exception:EXC-TRACER-001@v1",
      "kind": "exception",
      "id": "EXC-TRACER-001",
      "version": 1,
      "immutable": true,
      "source": {
        "path": ".www/control-ledger/registry/exceptions/EXC-TRACER-001.json",
        "digest": "0004df0c05ed47a574c8ca5fcfeac44169bd157b1cc9efe81f481cb200357459"
      }
    },
    {
      "ref": "exception:EXC-TRACER-002@v1",
      "kind": "exception",
      "id": "EXC-TRACER-002",
      "version": 1,
      "immutable": true,
      "source": {
        "path": ".www/control-ledger/registry/exceptions/EXC-TRACER-002.json",
        "digest": "8f854126206a2daf6c0b3ba2c5f82f7884ccb8c06498b890b34eb7f63e573312"
      }
    },
    {
      "ref": "exception:EXC-TRACER-003@v1",
      "kind": "exception",
      "id": "EXC-TRACER-003",
      "version": 1,
      "immutable": true,
      "source": {
        "path": ".www/control-ledger/registry/exceptions/EXC-TRACER-003.json",
        "digest": "31b2d63d6a181e447590c9129ac5ca302ae97e016aecb0524523459a45b335cb"
      }
    },
    {
      "ref": "exception:EXC-WORKBENCH-001@v1",
      "kind": "exception",
      "id": "EXC-WORKBENCH-001",
      "version": 1,
      "immutable": true,
      "source": {
        "path": ".www/control-ledger/registry/exceptions/EXC-WORKBENCH-001.json",
        "digest": "8561adf70e26ff899b283761435bd3ce201924a392641079079b450d7431139f"
      }
    },
    {
      "ref": "exception:EXC-WORKBENCH-002@v1",
      "kind": "exception",
      "id": "EXC-WORKBENCH-002",
      "version": 1,
      "immutable": true,
      "source": {
        "path": ".www/control-ledger/registry/exceptions/EXC-WORKBENCH-002.json",
        "digest": "9a9813d3f6bcde7757d6d43556dc21f12e9540d812727090b9f4129d7b54feff"
      }
    },
    {
      "ref": "exception:EXC-WORKBENCH-003@v1",
      "kind": "exception",
      "id": "EXC-WORKBENCH-003",
      "version": 1,
      "immutable": true,
      "source": {
        "path": ".www/control-ledger/registry/exceptions/EXC-WORKBENCH-003.json",
        "digest": "b95af3247c61c950864aaa9942ade16539095ae512474ef59661c529cb190f75"
      }
    },
    {
      "ref": "git-revision:worktree:2d0f8fdcfd6eb0dbf2f16707ebf98ff75885612b:dirty",
      "kind": "git-revision",
      "id": "worktree:2d0f8fdcfd6eb0dbf2f16707ebf98ff75885612b:dirty"
    },
    {
      "ref": "issue:WOO-674",
      "kind": "issue",
      "id": "WOO-674"
    },
    {
      "ref": "issue:WOO-678",
      "kind": "issue",
      "id": "WOO-678"
    },
    {
      "ref": "issue:WOO-679",
      "kind": "issue",
      "id": "WOO-679"
    },
    {
      "ref": "issue:WOO-680",
      "kind": "issue",
      "id": "WOO-680"
    },
    {
      "ref": "issue:WOO-681",
      "kind": "issue",
      "id": "WOO-681"
    },
    {
      "ref": "issue:WOO-682",
      "kind": "issue",
      "id": "WOO-682"
    },
    {
      "ref": "issue:WOO-686",
      "kind": "issue",
      "id": "WOO-686"
    },
    {
      "ref": "issue:WOO-687",
      "kind": "issue",
      "id": "WOO-687"
    },
    {
      "ref": "issue:WOO-688",
      "kind": "issue",
      "id": "WOO-688"
    },
    {
      "ref": "issue:WOO-689",
      "kind": "issue",
      "id": "WOO-689"
    },
    {
      "ref": "issue:WOO-690",
      "kind": "issue",
      "id": "WOO-690"
    },
    {
      "ref": "issue:WOO-691",
      "kind": "issue",
      "id": "WOO-691"
    },
    {
      "ref": "issue:WOO-692",
      "kind": "issue",
      "id": "WOO-692"
    },
    {
      "ref": "issue:WOO-695",
      "kind": "issue",
      "id": "WOO-695"
    },
    {
      "ref": "issue:WOO-696",
      "kind": "issue",
      "id": "WOO-696"
    },
    {
      "ref": "issue:WOO-697",
      "kind": "issue",
      "id": "WOO-697"
    },
    {
      "ref": "issue:WOO-698",
      "kind": "issue",
      "id": "WOO-698"
    },
    {
      "ref": "issue:WOO-699",
      "kind": "issue",
      "id": "WOO-699"
    },
    {
      "ref": "issue:WOO-700",
      "kind": "issue",
      "id": "WOO-700"
    },
    {
      "ref": "issue:WOO-701",
      "kind": "issue",
      "id": "WOO-701"
    },
    {
      "ref": "issue:WOO-702",
      "kind": "issue",
      "id": "WOO-702"
    },
    {
      "ref": "issue:WOO-703",
      "kind": "issue",
      "id": "WOO-703"
    },
    {
      "ref": "issue:WOO-704",
      "kind": "issue",
      "id": "WOO-704"
    },
    {
      "ref": "issue:WOO-705",
      "kind": "issue",
      "id": "WOO-705"
    },
    {
      "ref": "issue:WOO-706",
      "kind": "issue",
      "id": "WOO-706"
    },
    {
      "ref": "issue:WOO-707",
      "kind": "issue",
      "id": "WOO-707"
    },
    {
      "ref": "issue:WOO-708",
      "kind": "issue",
      "id": "WOO-708"
    },
    {
      "ref": "issue:WOO-709",
      "kind": "issue",
      "id": "WOO-709"
    },
    {
      "ref": "issue:WOO-718",
      "kind": "issue",
      "id": "WOO-718"
    },
    {
      "ref": "issue:WOO-719",
      "kind": "issue",
      "id": "WOO-719"
    },
    {
      "ref": "issue:WOO-720",
      "kind": "issue",
      "id": "WOO-720"
    },
    {
      "ref": "issue:WOO-721",
      "kind": "issue",
      "id": "WOO-721"
    },
    {
      "ref": "issue:WOO-722",
      "kind": "issue",
      "id": "WOO-722"
    },
    {
      "ref": "issue:WOO-723",
      "kind": "issue",
      "id": "WOO-723"
    },
    {
      "ref": "issue:WOO-724",
      "kind": "issue",
      "id": "WOO-724"
    },
    {
      "ref": "issue:WOO-725",
      "kind": "issue",
      "id": "WOO-725"
    },
    {
      "ref": "issue:WOO-726",
      "kind": "issue",
      "id": "WOO-726"
    },
    {
      "ref": "legacy:traceability-validation-v020-20260907",
      "kind": "legacy",
      "id": "traceability-validation-v020-20260907"
    },
    {
      "ref": "note:034d0686-30cf-4318-a70c-94b65e98bce7",
      "kind": "note",
      "id": "034d0686-30cf-4318-a70c-94b65e98bce7",
      "source": {
        "path": "Workbench/Todo — AI가 세운 계획을 세션별로 실시간 확인한다.md",
        "digest": "2e8761a419be7d7bf6bb9f602b7ee2d36431c3e511ef96f50c5c55c27a554f39"
      }
    },
    {
      "ref": "note:742cd6b6-37d9-4f64-a96d-273f4cfb4bea",
      "kind": "note",